{
  "slug": "doa-hordi-carrot-2024",
  "display_name": "HORDI — Carrot cultivation recommendation",
  "medium": "web_article",
  "publisher": "Horticultural Crops Research and Development Institute, DOA (Sri Lanka)",
  "authority": "doa_official",
  "url": "https://doa.gov.lk/hordi-crop-carrot/",
  "language": "en",
  "licence": "Government of Sri Lanka — attribution required"
}
