{
  "slug": "doa-rrdi-rice-varieties-2024",
  "display_name": "RRDI — Recommended rice varieties",
  "medium": "web_article",
  "publisher": "Rice Research and Development Institute, DOA (Sri Lanka)",
  "authority": "doa_official",
  "url": "https://doa.gov.lk/rrdi_rice_varities/",
  "language": "en",
  "licence": "Government of Sri Lanka — attribution required",
  "notes": "Authoritative released-variety list grouped by maturity (2.5 / 3 / 3.5 / 4–4.5 / 5–6 months). Sub-pages for fertilizer and disease management reference this list; dosages come from the DOA 2013 fertilizer booklet and DOA 2019 pesticide recommendation."
}
