{
  "slug": "doa-afaci-red-onion-2014",
  "display_name": "DOA / AFACI — Red Onion Cultivation Calendar (Dry Zone), 2014",
  "medium": "pdf",
  "publisher": "Department of Agriculture (Sri Lanka) · AFACI",
  "authority": "doa_official",
  "url": "https://www.doa.gov.lk/",
  "language": "si",
  "licence": "Government of Sri Lanka — attribution required",
  "published_at": "2014-06-01",
  "notes": "One-page infographic covering the full 48-week cycle: commercial cultivation Dec–May followed by seed-bulb production Jun–Nov. Source of the red-onion-dry-zone-maha cultivation plan."
}
