{
  "slug": "doa-hordi-tomato-2024",
  "display_name": "HORDI — Tomato cultivation recommendation",
  "medium": "web_article",
  "publisher": "Horticultural Crops Research and Development Institute, DOA (Sri Lanka)",
  "authority": "doa_official",
  "url": "https://doa.gov.lk/hordi-crop-tomato/",
  "language": "en",
  "licence": "Government of Sri Lanka — attribution required",
  "notes": "Public HORDI cultivation page. All dosages cite DOA 2019 pesticide recommendation."
}
