{
  "slug": "doa-frdi-banana-2024",
  "display_name": "DOA / FRDI — Banana cultivation",
  "medium": "web_article",
  "publisher": "Fruit Research and Development Institute, DOA (Sri Lanka)",
  "authority": "doa_official",
  "url": "https://doa.gov.lk/fruit-crops-banana-e/",
  "language": "en",
  "licence": "Government of Sri Lanka — attribution required",
  "notes": "English page is partially under construction; captured fields cover variety classification (AAA / AAB / AAAB / ABB / AABB), spacing, per-plant fertilizer programme, and the major disease set (Panama, Bunchy Top, Sigatoka)."
}
